<?xml version="1.0" encoding="UTF-8"?>
<!DOCTYPE Bataille [
<!ELEMENT Bataille (Humain, IA, Epoque, Courant)>
<!ELEMENT Humain (attaqueRates, attaqueTouches, bateaux)>
<!ELEMENT attaqueRates (attaque*)>
<!ELEMENT attaqueTouches (attaque*)>
<!ELEMENT attaque (x, y)>
<!ELEMENT x (#PCDATA)>
<!ELEMENT y (#PCDATA)>
<!ELEMENT bateaux (bateau*)>
<!ELEMENT bateau (type, hp, projectile, Positions)>
<!ELEMENT type (#PCDATA)>
<!ELEMENT hp (#PCDATA)>
<!ELEMENT projectile (#PCDATA)>
<!ELEMENT Positions (Position+)>
<!ELEMENT Position (x, y)>
<!ELEMENT IA (type, attaqueRates, attaqueTouches, bateaux)>
<!ELEMENT Epoque (#PCDATA)>
<!ELEMENT Courant (#PCDATA)>
] >
<Bataille>
<Humain>
<attaqueRates>
<attaque>
<x>1</x>
<y>1</y>
</attaque>
<attaque>
<x>1</x>
<y>5</y>
</attaque>
<attaque>
<x>6</x>
<y>5</y>
</attaque>
<attaque>
<x>5</x>
<y>5</y>
</attaque>
<attaque>
<x>9</x>
<y>1</y>
</attaque>
<attaque>
<x>7</x>
<y>0</y>
</attaque>
<attaque>
<x>2</x>
<y>8</y>
</attaque>
<attaque>
<x>5</x>
<y>8</y>
</attaque>
<attaque>
<x>5</x>
<y>3</y>
</attaque>
<attaque>
<x>7</x>
<y>3</y>
</attaque>
<attaque>
<x>6</x>
<y>4</y>
</attaque>
<attaque>
<x>3</x>
<y>4</y>
</attaque>
<attaque>
<x>3</x>
<y>1</y>
</attaque>
<attaque>
<x>4</x>
<y>0</y>
</attaque>
<attaque>
<x>8</x>
<y>8</y>
</attaque>
<attaque>
<x>8</x>
<y>5</y>
</attaque>
<attaque>
<x>9</x>
<y>5</y>
</attaque>
</attaqueRates>
<attaqueTouches>
<attaque>
<x>1</x>
<y>3</y>
</attaque>
<attaque>
<x>1</x>
<y>2</y>
</attaque>
<attaque>
<x>1</x>
<y>4</y>
</attaque>
<attaque>
<x>3</x>
<y>8</y>
</attaque>
<attaque>
<x>4</x>
<y>8</y>
</attaque>
<attaque>
<x>6</x>
<y>3</y>
</attaque>
<attaque>
<x>6</x>
<y>2</y>
</attaque>
<attaque>
<x>6</x>
<y>1</y>
</attaque>
</attaqueTouches>
<bateaux>
<bateau>
<type>ManOWar</type>
<hp>10</hp>
<projectile>4</projectile>
<Positions>
<Position>
<x>9</x>
<y>0</y>
</Position>
<Position>
<x>9</x>
<y>1</y>
</Position>
<Position>
<x>9</x>
<y>2</y>
</Position>
<Position>
<x>9</x>
<y>3</y>
</Position>
<Position>
<x>9</x>
<y>4</y>
</Position>
</Positions>
</bateau>
<bateau>
<type>Galion</type>
<hp>40</hp>
<projectile>3</projectile>
<Positions>
<Position>
<x>7</x>
<y>5</y>
</Position>
<Position>
<x>7</x>
<y>6</y>
</Position>
<Position>
<x>7</x>
<y>7</y>
</Position>
<Position>
<x>7</x>
<y>8</y>
</Position>
</Positions>
</bateau>
<bateau>
<type>Drakkar</type>
<hp>16</hp>
<projectile>19</projectile>
<Positions>
<Position>
<x>3</x>
<y>6</y>
</Position>
<Position>
<x>3</x>
<y>7</y>
</Position>
</Positions>
</bateau>
<bateau>
<type>Caravelle</type>
<hp>9</hp>
<projectile>12</projectile>
<Positions>
<Position>
<x>2</x>
<y>2</y>
</Position>
<Position>
<x>2</x>
<y>1</y>
</Position>
<Position>
<x>2</x>
<y>0</y>
</Position>
</Positions>
</bateau>
<bateau>
<type>Caravelle</type>
<hp>8</hp>
<projectile>20</projectile>
<Positions>
<Position>
<x>2</x>
<y>3</y>
</Position>
<Position>
<x>3</x>
<y>3</y>
</Position>
<Position>
<x>4</x>
<y>3</y>
</Position>
</Positions>
</bateau>
</bateaux>
</Humain>
<IA>
<type>0</type>
<attaqueRates>
<attaque>
<x>6</x>
<y>6</y>
</attaque>
<attaque>
<x>4</x>
<y>4</y>
</attaque>
<attaque>
<x>0</x>
<y>4</y>
</attaque>
<attaque>
<x>2</x>
<y>5</y>
</attaque>
<attaque>
<x>5</x>
<y>0</y>
</attaque>
<attaque>
<x>0</x>
<y>0</y>
</attaque>
<attaque>
<x>9</x>
<y>6</y>
</attaque>
<attaque>
<x>3</x>
<y>4</y>
</attaque>
<attaque>
<x>7</x>
<y>0</y>
</attaque>
<attaque>
<x>1</x>
<y>8</y>
</attaque>
<attaque>
<x>6</x>
<y>1</y>
</attaque>
<attaque>
<x>1</x>
<y>7</y>
</attaque>
<attaque>
<x>6</x>
<y>8</y>
</attaque>
<attaque>
<x>6</x>
<y>5</y>
</attaque>
<attaque>
<x>8</x>
<y>2</y>
</attaque>
<attaque>
<x>6</x>
<y>4</y>
</attaque>
<attaque>
<x>8</x>
<y>0</y>
</attaque>
<attaque>
<x>1</x>
<y>0</y>
</attaque>
<attaque>
<x>7</x>
<y>1</y>
</attaque>
</attaqueRates>
<attaqueTouches>
<attaque>
<x>2</x>
<y>0</y>
</attaque>
<attaque>
<x>4</x>
<y>3</y>
</attaque>
<attaque>
<x>2</x>
<y>3</y>
</attaque>
<attaque>
<x>9</x>
<y>2</y>
</attaque>
<attaque>
<x>9</x>
<y>4</y>
</attaque>
<attaque>
<x>9</x>
<y>0</y>
</attaque>
</attaqueTouches>
<bateaux>
<bateau>
<type>ManOWar</type>
<hp>45</hp>
<projectile>1</projectile>
<Positions>
<Position>
<x>9</x>
<y>7</y>
</Position>
<Position>
<x>8</x>
<y>7</y>
</Position>
<Position>
<x>7</x>
<y>7</y>
</Position>
<Position>
<x>6</x>
<y>7</y>
</Position>
<Position>
<x>5</x>
<y>7</y>
</Position>
</Positions>
</bateau>
<bateau>
<type>Galion</type>
<hp>40</hp>
<projectile>1</projectile>
<Positions>
<Position>
<x>0</x>
<y>4</y>
</Position>
<Position>
<x>0</x>
<y>5</y>
</Position>
<Position>
<x>0</x>
<y>6</y>
</Position>
<Position>
<x>0</x>
<y>7</y>
</Position>
</Positions>
</bateau>
<bateau>
<type>Drakkar</type>
<hp>0</hp>
<projectile>25</projectile>
<Positions>
<Position>
<x>4</x>
<y>8</y>
</Position>
<Position>
<x>3</x>
<y>8</y>
</Position>
</Positions>
</bateau>
<bateau>
<type>Caravelle</type>
<hp>6</hp>
<projectile>13</projectile>
<Positions>
<Position>
<x>1</x>
<y>2</y>
</Position>
<Position>
<x>1</x>
<y>3</y>
</Position>
<Position>
<x>1</x>
<y>4</y>
</Position>
</Positions>
</bateau>
<bateau>
<type>Caravelle</type>
<hp>0</hp>
<projectile>18</projectile>
<Positions>
<Position>
<x>6</x>
<y>1</y>
</Position>
<Position>
<x>6</x>
<y>2</y>
</Position>
<Position>
<x>6</x>
<y>3</y>
</Position>
</Positions>
</bateau>
</bateaux>
</IA>
<Epoque>0</Epoque>
<Courant>0</Courant>
</Bataille>
